{
  "company": "Comodo",
  "config": {
    "default": {
      "ipv4": [
        "8.26.56.26",
        "8.20.247.20"
      ]
    }
  },
  "icon": "https://www.vectorlogo.zone/logos/comodo/comodo-icon.svg",
  "location": "us",
  "logo": "https://www.vectorlogo.zone/logos/comodo/comodo-ar21.svg",
  "name": "Comodo Secure DNS",
  "tags": [],
  "url": "https://www.comodo.com/secure-dns/"
}
