{
  "company": "DNS.WATCH",
  "config": {
    "default": {
      "ipv4": [
        "84.200.69.80",
        "84.200.70.40"
      ],
      "ipv6": [
        "2001:1608:10:25::1c04:b12f",
        "2001:1608:10:25::9249:d69b"
      ]
    }
  },
  "icon": "https://www.vectorlogo.zone/logos/dnswatch/dnswatch-icon.svg",
  "location": "de",
  "logo": "https://www.vectorlogo.zone/logos/dnswatch/dnswatch-ar21.svg",
  "name": "DNS.WATCH",
  "tags": [],
  "url": "https://dns.watch/index"
}
